cleaned_comment	orig_lang	speech	cGood
yes, in Spain we have a situation that is different than with them in Germany. So traditionally, we have always been an immigration country. In this respect, it's the case with us that in Spain you don't quite see yet what the effects are that you've already had in Germany. And we are now also experiencing them in England, for example, with the Pakistanis or in Paris with the people from Algeria. As a result, it's quite important for us to get to know their experiences. Because as you just said, the immigrants who went to France, they were Spanish, they were Italian. But now that we're all in the EU, we don't see ourselves as immigrants anymore. So for example there are still Spaniards who go to France to work because we have the common market. And now we only talk about migration, that is, transfers, for example, that workers go from one country to another and so on. And of course it's also true that we have, let's say, come closer together. We are all in Europe now, and we differ from those who come from outside Europe, for example the Africans of the Near East. For example, they have a religion that is somewhat antagonistic to ours. And there is now the following: finally I had the chance to stay during a time in Morocco. And of course we were afraid of the unknown and of this society, which is so different from ours. And I had the opportunity now to live there and I suddenly understood why they want to come to Europe. You know why they want to. Because nobody has money. But they all want a satellite dish, or they want to have all the European channels. And then they see the beautiful houses, then they see the beautiful parks and a world that seems almost an ideal world. Yes, and now they have that right on their doorstep, so to speak. And there it's very difficult for someone to see that, in their own situation. For example, in Median or in Fez. And there you have the feeling that regressions are being made, so it's almost like going back to the Middle Ages. And the big fish, they swim right in front of the door. And otherwise you only have mosquitoes. Or flies. And if you buy a leather vest, for example, it stinks like anything. And the Arabs work under this inhumane milieu and they see what we live there, then of course they feel like coming to us. And I am the first to understand how they feel.   but of course we can't take in the whole world. But you understand the reasons why they want to come to us. They all have television and that's interesting to see by the way. In a country where it also has poverty neighborhoods, that they all have satellite dishes. And they all try to have television, of course. And so globalization is spreading to the farthest corners. And I can tell you that in the Atlas Mountains near Marrakech, for example, there is a small residential area that is medieval. But the people, they offer then their specialties and so, but all have TVs with satellite dishes and see what's on, for example, in Madrid. And all of Africa has seen how Madrid played against Barcelona, for example. So you're really globalized. So it goes all the way to the last corners of the world. And of course I don't want to go on for too long here, but this whole issue has become so complicated. And of course, you can't close all the borders now. You would really have to put up a guardian every 200 meters, even in Amelia, in this little enclave they really put up grids that are four meters high and still people try to climb over them.	de	[33:20] ja, in Spanien haben wir eine Situation, die anders ist, als bei ihnen in Deutschland. Also traditionellerweise sind wir immer ein Einwanderungsland gewesen. Insofern ist es bei uns so, dass in Spanien man es noch nicht ganz sieht wie jetzt die Auswirkungen sind, die Sie in Deutschland schon gehabt haben. Und die wir jetzt zum Beispiel auch in England jetzt erleben mit den Pakistani oder in Paris mit den Leuten aus Algerien. Infolgedessen ist es ganz wichtig für uns, ihre Erfahrungen kennen zu lernen. Denn wie du gerade gesagt hast, ist es so, dass die Einwanderer, die nach Frankreich gingen, das waren Spaniern, das waren Italiener. Aber da wir jetzt alle in die EU gehören, sehen wir uns jetzt nicht mehr als Einwanderer. Also zum Beispiel es gibt immer noch Spanier, die nach Frankreich gehen, um da zu arbeiten, weil wir ja den gemeinsamen Markt haben. Und man spricht jetzt nur noch von Migration, also von Transfers, zum Beispiel dass eben Arbeitskräfte von einem Land ins andere gehen und so weiter. Und es stimmt natürlich auch, dass wir uns sagen wir mal, näher gekommen sind. Wir sind jetzt alle in Europa und unterscheiden uns damit von denen, die von ausserhalb von Europa kommen, zum Beispiel die Vorderafrikaner. Die haben zum Beispiel eine Religion, die unserer etwas antagonistisch gegenübersteht. Und da gib es jetzt folgendes: letztlich hatte ich die Chance, mich während einer Zeit in Marokko aufzuhalten. Und wir hatten natürlich Angst vor dem Unbekannten und dieser Gesellschaft, die ja so anders ist als die unsere. Und ich hatte die Möglichkeit jetzt, dort zu leben und ich habe auf einmal verstanden, warum die nach Europa kommen wollen. Man weiss, warum sie wollen. Weil keiner Geld hat. Alle wollen aber eine Parabolantenne, oder wollen alle europäischen Kanäle haben. Und dann sehen sie die schönen Häuser, dann sehen sie die wunderschönen Parks und eine Welt, die fast eine Idealwelt scheint. Ja und das haben sie jetzt direkt vor der Tür sozusagen. Und da ist es sehr schwierig für jemanden, der das sieht, in seiner eigenen Situation. Zum Beispiel in Median oder in Fes. Und da hat man das Gefühl, dass Rückschritte gemacht werden, also als wäre es fast so als würde man ins Mittelalter. Und die dicken Fische, die schwimmen direkt vor der Tür. Und sonst hat man nur Mücken. Oder Fliegen. Und wenn man da zum Beispiel eine Lederweste kauft, dann stinkt die wie sonst was. Und die Araber arbeiten unter diesem unmenschlichen Milieu und die sehen also, was wir da leben, dann haben die natürlich Lust, zu uns zu kommen. Und ich bin die erste, die infolgedessen versteht, wie denen zumute ist. [36:35] [36:51] aber wir können natürlich nicht die ganze Welt bei uns aufnehmen. Aber man versteht die Gründe, warum sie zu uns kommen wollen. Sie haben alle Fernsehen und das ist übrigens auch interessant zu sehen. In einem Land wo es auch Armutsviertel hat, dass die alle Parabolantennen haben. Und alle versuchen also natürlich Fernsehen zu haben. Und damit verbreitet sich die Globalisierung bis in die hinterste Ecke hinein. Und ich kann ihnen sagen, also im Atlasgebirge, in der Nähe von Marrakesch, da gibt es zum Beispiel eine kleine Wohnsiedlung, die mittelalterlich ist. Aber die Leute, die bieten dann ihre Spezialitäten an und so, aber alle haben Fernseher mit Parabolantennen und sehen, was zum Beispiel in Madrid läuft. Und ganz Afrika hat erlebt, wie zum Beispiel Madrid gegen Barcelona da gespielt hat. Man ist da also wirklich globalisiert. Also bis in die letzten Zipfel der Welt hinein geht das. Und ich will jetzt natürlich  nicht jetzt hier zu lange sprechen, aber dieses ganze Thema ist derart kompliziert inzwischen. Und man kann jetzt natürlich nicht alle, also man müsste jetzt alle Grenzen schliessen. Man müsste wirklich alle 200 Meter einen Hüter aufstellen, sogar in Amelia, in dieser kleinen Enklave hat man wirklich Gitter aufgestellt, die vier Meter hoch sind und trotzdem versuchen die Leute, darüber zu steigen. [38:30]	2
"I wanted to say that I only know German law. The law of these days in Germany does not allow the situation of illegality. And to say ""I am undocumented, I am illegal, I have violated the law of these days in Germany, but I still want to stay here. ""I don't think that works. I think these people will simply be deported. So, a change of the law in Germany, the law on the right of these days, should be done instead. At least as far as Germany is concerned."	fr	[48 :30] Moi je voulais dire que je ne connais que le droit allemand. Le droit de ces jours en Allemagne ne permet pas la situation de l’illégalité. Et dire « je suis sans-papiers, je suis illégale, j’ai violé le droit de ces jours en Allemagne, mais je veux quand même rester ici. » Je ne pense pas que ça marche. Je pense ces personnes seront tout simplement expulsés.  Donc, il faudrait plutôt alors procéder un changement de loi en Allemagne, la loi sur le droit de ces jours. En tous cas en ce qui concerne l’Allemagne. [49 :05]	0
With regard to this point of view, I would like to give my opinion. What is the use of a qualification, what is the use of training if the diplomas are not recognized? I have experienced this myself many times in my professional activity that we have people, for example, who have a university or college degree from Russia, who already have work experience in highly qualified professions. But in diplomas, qualifications are not recognized. This is the problem. And then we say we have doctors, we have a lot of people who come to us to work and quite qualified. So when we talk about the emigration of German doctors, all of a sudden we ask these doctors - some years ago, fifteen years ago, it was impossible, it was very very difficult for example to realize a transition year and to adapt to the medical system in Germany. Today it is different, the possibility exists. But in other professions, it is really extremely difficult to have a diploma recognized. And I don't think this is the right solution.	fr	[42 :31] En ce qui concerne ce point de vue, je voudrais donner mon opinion. À quoi sert une qualification, à quoi sert une formation si les diplômes ne sont pas reconnus ? J’ai vécu cela moi-même nombreuses fois dans le cadre de mon activité professionnelle que nous avons des personnes, par exemple qui ont un diplôme d’université ou d’école supérieure en provenance de Russie, qui ont déjà une expérience professionnelle dans des métiers très qualifiés. Mais dans des diplômes, les qualifications ne sont pas reconnus. C’est ça justement le problème. Et puis on dit nous avons des médecins, nous avons beaucoup des personnes qui viennent chez nous pour exercer une activité professionnelle et tout-à-fait qualifié. Alors quand on parle à l’émigration des médecins allemands, tout à coup on demande ces médecins – il y a quelques années, il y a quinze ans, c’était impossible, c’était très très difficile par exemple de réaliser une année de transition et de s’adapter au système médical en Allemagne. Aujourd’hui c’est différent, la possibilité existe. Mais dans d’autres professions, il est vraiment extrêmement difficile d’avoir une reconnaissance de diplôme. Et je ne pense pas que ce soit la bonne solution. [43 :42]	0
To your comment; that's true, but the first one is also decisive; there is also a certain percentage who don't want to integrate. This has nothing to do with us; we have a very high percentage of Turkish citizens, that's true - in Germany that is specific in every corner also from the Hopferau, so northern Bavaria where I come from, many are with us in Hof, the proportion of Turks in Hof makes up a third of the population; you would not think that for such a medium-sized place, but it's really because of the cultural circle, where they come from and another comparable example now outside the EU yet: In the Hof area, we currently have a large wave of immigration of German citizens, as they say, well, these so-called Russian Germans from Kazakhstan, from Uzbekistan and other former CIS states, who come to us, and it is striking that younger people come from a cultural area where they themselves had their friends and their acquaintances and definitely their social ties, but because of the family circumstances, it is so that the parents say that we are going there now, then they have to come with us. We have huge problems in the Hof area with the integration of these groups.	de	[50:59] Zu deinem Kommentar noch; das stimmt, aber das erste ist auch ausschlaggebend; es ist ja auch ein gewisser Prozentsatz da, die wollen sich nicht integrieren. Das hat jetzt gar nichts mit uns zu tun; wir haben eine sehr hohen Anteil von türkischen Mitbürgern, das stimmt – in Deutschland ist das spezifisch in jeder Ecke auch aus dem Hopferau, also nördliches Bayern wo ich herkomme, sind viele bei uns in Hof, macht der Anteil der Türken  in Hof ein Drittel der Bevölkerung aus; das denkt man gar nicht für so einen mittelständischen Ort, aber es liegt wirklich da auch an dem Kulturkreis, wo sie herkommen und ein anderes vergleichbares Beispiel jetzt ausserhalb der EU noch: Wir haben zur Zeit im Raum Hof eine grosse Einwanderungswelle eigentlich deutscher Staatsbürger wie man so schön sagt, na; diese sogenannten Russendeutschen aus Kasachstan, aus Usbekistan und anderer ehemaliger GUS-Staaten, die zu uns rein kommen, und da ist bei gerade jüngeren Leuten jetzt auffallend, die kommen aus einem Kulturkreis, wo sie dort selbst ihre Freunde hatten und ihre Bekannten und durchaus ihre sozialen Bindungen, aber aufgrund der familiären Gegebenheiten das eben so ist, dass die Eltern sagen da gehen wir jetzt hin, dann müssen die mit. Wir haben riesen Probleme im Raum Hof mit der Integration dieser Gruppen. [52:15]	0
Yeah, I have my doubts about that. The people who come into the EU by plane come as tourists. They have enough money, they can stay here as tourists for three months. If they stay after that, I don't see any other solution than having them followed by the police or whatever. I don't know how else to solve it, so maybe it's not what we want. The situation in Spain is very clear. You arrive. In some Latin American countries, they need a visa, they need to be invited. There is a quota that has been worked out with the relevant countries. So there they have to be invited and prove that they have enough resources. Now on the subject of immigration to the United States. That's where they ask you where you plan to live, that's then entered and can possibly be reviewed within the next five days. They rarely do that, of course, but they can then intervene if the worst comes to the worst, and we can put those kinds of checks in place. They should be able to prove that they have sufficient funds, and with the Americans, they should definitely have an invitation. If they don't have an invitation, they will be sent back.	de	[31:18] Ja, ich hab da so meine Zweifel. Die Leute, die mit dem Flugzeug in die EU reinkommen, kommen als Touristen. Die haben genügend Geld, die können hier als Touristen drei Monate bleiben. Wenn sie danach bleiben, sehe ich nichts anderes als Lösung als sie verfolgen lassen von der Polizei, oder sonst was. Ich weiss nicht wie man das sonst lösen könne, also es ist vielleicht nicht, was wir uns wünschen. Die Lage in Spanien ist ganz klar. Du kommst an. In manchen lateinamerikanischen Ländern brauchen sie ein Visum, sie müssen eingeladen werden. Es gibt eine Quote, die ausgearbeitet worden ist mit den entsprechenden Ländern. Da müssen sie also eingeladen werden und beweisen, dass sie über genügend Mittel verfügen. Nun zum Thema der Einwanderung in die Vereinigten Staaten. Da wird man gefragt, wo du vor hast, zu leben, das wird dann eingetragen und kann möglicherweise überprüft werden innerhalb der nächsten fünf Tage. Das tun sie natürlich selten, aber sie können im Falle des Falles dann eingreifen und solche Kontrollen können wir bei uns einführen. Sie sollen beweisen können, dass sie über genügend Mittel verfügen und bei den Amerikanern sollten sie unbedingt über eine Einladung verfügen. Wenn sie keine Einladung haben, werden sie zurück geschickt. [33:22]	0
Well yes, but even from the economic point of view it is bad for the economy. It introduces a turmoil and unfair competition. And it leads to the, also illegal, bankruptcy. This is an abuse. I think that penalties should be imposed.	pl	[39:15] Well yes, but even from the economic point of view it is bad for the economy. It introduces a turmoil and unfair competition. And it leads to the, also illegal, bankruptcy. This is an abuse. I think that penalties should be imposed.[39:31]	0
I heard somewhere - I don't remember exactly where it was - that sometimes we fill planes in these third countries with children, we send them to our countries but if these children at that time would be protected, they already have their place in our society. I'm not against children, of course, but even if they are illegal, I would like them to be able to go to school, to have the opportunity to get an education.	fr	[27:24] Moi j’ai entendu quelque part – je m’en souviens plus très bien où c’était – que parfois on rempli des avions dans ces pays tiers avec des enfants, on les envoie dans nos pays mais si ces enfant à ce moment-là serait protégés, ils ont déjà leur place dans notre société. Moi évidemment je ne suis pas contre les enfants et surtout même si ce sont des illégaux je voudrais bien qu’ils puissent aller à l’école, qu’ils aient la possibilité de suive une formation. [27:54]	0
Do the Chinese bother you because they are physically different and they don't look like you or is it because they are immigrants?	fr	[20:08] Les Chinois ils vous gênent parce qu’ils sont différents physiquement et ils vous ne ressemblent pas ou c’est parce que ce sont des immigrants ? [20:18]	0
That's true, because here in Germany there are now very many different nationalities living here, but it was also determined by the EU in some study that the Turks have actually been integrated the least and wanted to integrate the least. So they wanted to create their own ghettos and just came here to earn money; that was the only priority that they set - in my opinion.	de	[49:16] Also das stimmt, weil nämlich bei uns hier in Deutschland nun einmal jetzt sehr sehr viele verschiedene Nationalitäten leben aber es ist ja auch von der EU einmal in irgend einer Studie festgestellt worden, dass eigentlich die Türken am wenigsten integriert worden sind und am wenigsten sich integrieren wollten. Also die wollten schon so ihre eigenen Ghettos schaffen und sind halt einfach nur hierher gekommen, um Geld zu verdienen; das war die einzige Priorität, die die gesetzt haben – meiner Meinung nach. [49:45]	0
To tell you the truth, I do not know what is discussed? Are we talking about the quotas – how many people could come here?	pl	[43:16] To tell you the truth, I do not know what is discussed? Are we talking about the quotas – how many people could come here?  [43:24]	1
Yes, I just wanted to say that in France, the problem of immigration, the refusal of immigrants, is often linked to a political coloration, which is practically the extreme right. This is a bit of a context, and obviously, it bothers a lot those who think that the extreme right leads to things that are completely harmful, that are generally anti-European and anti-immigration. Well, that's to close the parenthesis. I would simply like to say that of course, I am completely - I think that it is impossible to avoid legal immigration in Europe. So, a certain amount of legal immigration, I say legal, that is to say that it is planned, calculated, but simply, my personal concern is that this legal immigration, in my opinion, must be compensated by means that must be given to the country of departure of these immigrants, because it will always continue if we steal their brains from the poor country. So soon, my colleague [GE] just now talked about the Togolese doctors who were extremely numerous in the Paris region, right? And soon, in Togo, there were French doctors. It is beginning to letter? and since there are many many French doctors who are going to practice in Togo in the framework of humanitarian missions, with humanitarian associations. So, we have here something that is not going very well. Shouldn't we, I don't know, in the bilateral agreements, see if we can't facilitate the return of Togolese doctors to Togo, so that they participate in the greatness and development of their country rather than [keeping] Togolese brains in France? So I know, of course, when you take immigrants in a poor country, it makes an economy for the country that receives it. That's for sure, when we receive someone who has an education and when we have not paid for his training, it makes an economy to (...) for the country that receives him. So all this, I think that immigration must be calculated and we must know what we take from the poor country to start it. I believe that we need legal immigration but within the framework, of agreement, either of Europe with the countries of the third world, or of bilateral agreements from country to country.	fr	[03:28] Oui, moi je voulais dire simplement, bon, en France, le problème de l’immigration, du refus des immigrés, est souvent liée à une coloration politique, qui est pratiquement l’extrême droite. C’est un peu le contexte et évidemment, ça gène beaucoup tout ce qui pensent que l’extrême droite conduit à des choses qui sont tout à fait néfaste, qui sont en général anti-européen et anti-immigration. Bon, ça c’est pour fermer la parenthèse. Simplement, moi je voudrais dire que bien sur, je suis tout à fait – je pense que c’est impossible d’éviter en Europe une immigration légale. Donc, une certaine quantité d’immigration légale, je dis bien légale, c'est-à-dire qui soit prévue, calculée, mais simplement, mon souci personnel, c’est que cette immigration légale, à mon avis, elle doit être compenser par des moyens qui doivent être donner au pays de départ de ces immigrés, parce que ça continuera toujours si on pique au pays pauvre leur cerveaux. Alors bientôt bon, mon collègue[GE] tout à l’heure à parler des médecins togolais qui étaient extrêmement nombreux dans la région Parisienne, c’est ça ? Et bientôt, au Togo, s’avait des médecins français. Ça commence d’ailleurs à lettre[ ?] et puisque il y a beaucoup beaucoup beaucoup de médecins français qui se vont exercer au Togo dans le cadre des missions humanitaires, avec les associations humanitaires. Alors, on a là quelque chose qui ne va pas très bien. Est-ce qu’il ne faudrait pas,  je ne sais pas, dans les accords bilatéraux voir si on ne peut pas faciliter le retour des médecins togolais au Togo, pour qu’ils participent à la grandeur et au développement de leur pays plutôt que de [garder] les cerveaux togolais en France ? Alors je sais bien, c’est sur, quand on prend des immigrés dans un pays pauvre, ça fait une économie pour le pays qui le reçoit. Ça c’est certain, quand on reçoit quelqu’un qui a une formation et quand on n’a pas payé sa formation, ça fait une économie à (…) pour le pays qui le reçoit. Alors tout ça, je crois que l’immigration, elle doit être calculé et on doit savoir ce qu’on prend du pays pauvre pour le commencer. Moi je crois qu’il faut une immigration légale mais dans le cadre, d’accord, soit de l’Europe avec les pays des tiers monde, soit des accords bilatéraux de pays à pays. [06 :31]	0
The problem of the EU, apart from immigration, is the European constitution. It was thought from the beginning that the European constitution would be approved by everybody. By all the countries. And the no from France and the Dutch and then from Ireland was a real blow. Because all that we would get, this wonderful constitution, which was already so difficult to set up and work out, that really also cost us very dearly. And that has hindered the whole European development. And if we don't want to have, for example, the failure, then we have to give up some things and re-set the priorities. And the sovereignty, this upper, so you have to transfer some things to the EU. For example, this whole issue of immigration.	de	[1:39:32] das Problem der EU, mal abgesehen von der Einwanderung. ist eben die europäische Verfassung. Man dachte von Anfang an, dass die europäische Verfassung von allen genehmigt werden würde. Von allen Ländern. Und das Nein von Frankreich und den Niederländern und dann von Irland war ein wirklicher Schlag. Denn all das was wir bekommen würden, diese wunderbare Verfassung, die schon so schwer aufzustellen und zu erarbeiten war, das hat uns wirklich auch sehr teuer zu stehen bekommen. Und das hat die ganze europäische Entwicklung behindert. Und wenn wir zum Beispiel nicht den Misserfolg haben wollen, dann müssen wir auf einige Dinge verzichten und die Prioritäten neu setzen. Und die Souveränität, diese obere, also man muss da einiges an die EU übertragen. Zum Beispiel dieses ganze Thema der Einwanderung. [1:40:33]	2
