cleaned_comment	orig_lang	speech	cGood
... Indeed, we can take up an idea that has already been put forward in relation to, in fact, the problem of how to welcome immigrants and on what criteria between [...]. But in a more general way [...] it is to ask the question of what generates this migratory movement. Well, the migratory movement we have always had. All along the history of the world. But today, to take the example of Africa, I believe that it is in Senegal where there are many young men who take the sea to reach Europe. These men die at sea. And these Senegalese women who have mobilized to do everything possible to retain their men today. So it's true that we can eventually do actions, there are actions that a development moreover one that set up by the French government to help the assembly of projects on the spot. So we are talking about countries that generate a lot of immigration. But there we are also confronted with the logic of means because especially in times of crisis where the financial issue becomes more and more crucial. There is also a mobilization that must be facilitated at the level of these countries so that the countries take charge of identifying the motivations of the shares and then make sure that the populations do not move. So there are different reasons; health reasons, economic reasons and political reasons. It is sure that, whatever solution we put in place at the European level, we will not be able to solve the motivation of migration. So it's true, it's in the law of Europe, it's, what is interesting is that Europe plays a role in [...] on the moderation of migratory flows I think. That is really a political role so that globally we can regulate these migratory movements.	fr	[54 :32] ..effectivement reprendre une idée qui a déjà été émise par rapport à, en fait, il y a la problématique de comment on accueille les immigrées et sur quel critère entre [...]. Mais d’une façon plus en […] c’est de se poser la question de qu’est-ce qui génère ce mouvement migratoire. Bon, le mouvement migratoire on a toujours eu. Tout en longue de l’histoire du monde. Mais aujourd’hui pour reprendre cet exemple de l’Afrique je crois que c’est au niveau du Sénégal ou il y a énormément de jeunes hommes qui prennent la mer pour partir rejoindre l’Europe. Ces hommes qui meurent à la mer. Et ces femmes sénégalaises qui se sont mobilisés pour tout faire en sorte pour retenir aujourd’hui leurs hommes. Donc c’est vrai que nous on peut faire éventuellement des actions, il y a des actions qu’un développement d’ailleurs un qui mise en place par le gouvernement français pour aider au montage des projets sur place. Donc on parle des pays qui génèrent beaucoup d’immigration. Mais bon, là on est aussi confronté a des logiques des moyens parce que bon, surtout en période de crises ou la question financière devient plus en plus cruciales. Y a aussi une mobilisation certainement a faciliter au niveau de ces pays pour que les pays se prennent en charge pour identifier réellement les motivations des parts et puis faire en sort effectivement que les populations ne se bougent pas. Alors il y a des différentes raisons; des raisons sanitaires et des raisons économiques et des raisons politiques. C'est sur que, la, quelques soit la solution qu’on met en place au niveau de l’Europe, on n’aura pas pour régler la motivation de la migration du fait migratoire. Donc c’est vrai, c’est au de loi de l’Europe c'est, ce qui est intéressant, c’est que l’Europe joue un rôle en [..] sur la modération de flux migratoires je pense. Qu’est réellement un rôle politique pour qu’au plan mondial on puisse réguler ces mouvements migratoires. [56:57]	0
In fact what is an illegal immigrant because for me there are as many immigrants, as many different situations as the individual and that's why between the three options that are proposed, like a selective regularization would be more interesting with defined criteria. I'll take a simple example: In France, someone who comes to work in France legally is given a residence permit, that's it for ten years, during these ten years he builds a job, he builds a family, he has children who are French, because he was born in France and at the end of the ten years, for [... ...] because the rules have sometimes changed during these ten years, they find themselves with an expired residence permit and he finds himself completely illegal and clandestine. What do we do with these people? Should we throw them out? I don't think so. So that's what's difficult, to find a solution that will solve the problem for everyone. And here is also something I wanted to add: we have the case of illegal work, especially people who exploit and mistreat men and women, who exploit these workers, who make money and I think that our states, our governments must focus on - I don't know - tracking down these people for these employers who are dangerous. And in this case, often these are jobs that are refused by people who are legal, so again, here's an opportunity for selective regularization.	fr	[31:48] En fait qu’est que c’est un immigré illégal parce que pour moi il y a autant d’immigrés, autant de situations différentes que l’individu et c’est pour ça entre des trois options qui sont proposées, comme une régularisation sélective serait plus intéressante avec des critères définis.  Je prends un exemple tout simple : En France, quelqu’un qui vient travailler en France légalement se voit attribué à une carte de séjours, voilà pendent dix ans, pendant ces dix ans il construit un métier, il construit une famille, il a des enfants qui sont français, parce que né en France et au bout des dix ans, pour [… … …] parce que les règles ont parfois changé pendant ces dix années, ils se retrouve avec une carte de séjour expirée et lui il se retrouve complètement illégal et clandestin. Que faire avec ces gens-là ? Est-ce qu’on doit les jeter dehors ? Je ne pense pas. Donc c’est ça qui est difficile, de trouver une solution qui règlera le problème pour tout le monde. Et voilà, aussi quelque chose que je voulais ajouter : C’est qu’on a le cas de travail au noir, notamment des gens qui exploitent largement et maltraite les hommes et des femmes, qui exploitent ces travailleurs, qui se font de l’argent déçu et je pense que nos états, nos gouvernements doivent mettre l’accent pour – je ne sais pas – traquer ces gens pour ces employeurs qui eux sont dangereux. Et dans ce cas-là, souvent ce sont des métiers qui sont refusés par les gens qui sont en situation régulière, donc voilà encore une fois, une possibilité de régularisation sélective. [33:41]	2
I was talking about the English language not Polish (Laugh) because my Polish is not yet perfect. (Laugh) So we would like to have such a language. If it was English then we could communicate with other parts of the world for example with the US. Of course Polish is a beautiful language.	pl	[1:01:50]I was talking about the English language not Polish (Laugh) because my Polish is not yet perfect. (Laugh) So we would like to have such a language. If it was English then we could communicate with other parts of the world for example with the US. Of course Polish is a beautiful language.[1:02:12]	0
I would say that you never know how something will turn out when you start something, but you have to try it! You just have to give it a try, maybe it will work. And I also see Obama as a role model somehow, he has in this chaos in America, I mean that is so terrible what has happened there everything and he just tries it and you have to do it, you have to try it. You'll see if it works or doesn't work.	de	[76:35] Ich würde sagen, man weiss ja nie wie irgendetwas ausgeht, wenn man irgendwas anfängt, aber man muss es doch versuchen! Man muss es doch einfach mal versuchen, vielleicht klappt es ja. Und ich sehe da auch Obama als Vorbild irgendwie, der hat in diesem Chaos in Amerika, ich meine das ist so schrecklich was da alles passiert ist und er versucht es einfach und man muss es machen, man muss es versuchen. Man wird ja dann sehen ob es klappt oder nicht klappt. [77:07]	0
So it is just how it was with the gypsies in Slovenia. Exactly the same problem appears. In fact, gypsies in Slovenia are problematic because they do not want to work. They do not pay for school, for meals in school, they also do not want to pay. So we need to give them some kind of lesson, teach them something, educate. Sometimes even children do not want to go to school. Give them a rod that would actually fit me. It works somehow. Of course it is not easy. We should first think of why we are doing this, how much we can gain of this?	pl	[1:11:55]So it is just how it was with the gypsies in Slovenia. Exactly the same problem appears.  In fact, gypsies in Slovenia are problematic because they do not want to work. They do not pay for school, for meals in school, they also do not want to pay. So we need to give them some kind of lesson, teach them something, educate. Sometimes even children do not want to go to school. Give them a rod that would actually fit me. It works somehow. Of course it is not easy. We should first think of why we are doing this, how much we can gain of this?[1:13:07]	0
It's not immigrants as we talk about because there are immigrants in every country, they have a nationality, I say in every country there are gypsies. Every country - I mean they go around the world but I mean they have a country, they are not the majority and they are still part of Europe, they are not - I mean it's not illegal, they are not - I'm not sure if you understand what I mean but -.	fr	[42:21] Ce n’est pas des immigrants comme on parle parce qu’il y en a dans tous les pays, ils ont une nationalité, je dis qu’il y a dans tous les pays des gitans. Chaque pays – je veux dire ils se baladent dans le monde mais je veux dire ils ont un pays, ils ne sont pas la majorité et ils sont quand-même partie de l’Europe, ils ne sont pas – je veux dire ce n’est pas illégal, ils ne sont pas – je ne suis pas sur si vous comprenez ce que je veux dire mais –. [42:50]	0
So, the question of whether we should close the borders or not would not arise if we were trying to prevent people from wanting to come into Europe at all. People don't actually want to give up their homeland, I think at least. They want to do that because they live in unbelievable misery. They don't have anything to eat, they don't have anything to drink, and then they probably see on television, which they have, what it looks like in Europe. This means that if we try to build up structures - economic structures - there, provide much more reconstruction aid and so on, we will certainly save ourselves some huge mass migrations towards Europe, which is certainly more favorable in the long term than sealing off Europe. We have huge borders in the east and peoples will probably migrate from the east at some point. And secondly, in the long run, you also create large sales markets. The EU is so successful, also economically so successful, because it relies on cooperation and not on confrontation and competition. Competition within, but within a certain framework. By and large: cooperation. If we try to enforce that as the EU worldwide or at least on a larger scale, then maybe we can [not only] prevent people from living in poverty on the one hand, not having anything to eat, not having anything to drink, starving, dying of thirst, but we can also eliminate problems for us and probably even create sales markets still for our domestic economy.	de	[1:26:55] also, die Frage, ob wir die Grenzen zu machen sollen oder nicht, würde sich ja nicht stellen, wenn wir  versuchen würden, dass die Leute überhaupt nach Europa hinein wollen. Die Leute wollen eigentlich ja nicht ihre Heimat aufgeben, denke ich zumindest. Das wollen sie, weil sie in einem unglaublichen Elend leben. Nichts zu essen haben, nichts zu trinken haben und dann wahrscheinlich übers Fernsehen, das sie dann haben, sogar noch sehen, wie es in Europa aussieht. Das heisst, wenn wir versuchen, dort Strukturen – wirtschaftliche Strukturen – aufzubauen, viel mehr Aufbauhilfe leisten und so weiter, ersparen wir uns sicher einige riesige Völkerwanderungen Richtung Europa hin, was auf Zeit sicherlich einerseits günstiger ist, als die Abriegelung Europas. Dazu bräuchte man massenhaft Militär, wir haben im Osten riesige Grenzen und auch aus dem Osten werden wahrscheinlich irgendwann die Völker migrieren. Und zweitens schafft man auf lange Sicht auch grosse Absatzmärkte. Die EU ist so erfolgreich, auch wirtschaftlich so erfolgreich, weil sie auf Kooperation setzt und nicht auf Konfrontation und auf Konkurrenz. Konkurrenz innerhalb, aber in einem bestimmten Rahmen. An sich im Grossen und Ganzen: Kooperation. Wenn wir das versuchen als EU weltweit durchzusetzen oder zumindest im grösseren Stil, dann können wir vielleicht damit [nicht nur] verhindern, dass Leute einerseits in Armut leben, nichts zu essen haben, nichts zu trinken haben, verhungern, verdursten, sondern können auch für uns Probleme beseitigen und wahrscheinlich sogar Absatzmärkte noch für unsere heimische Wirtschaft schaffen. [1:29:05]	2
That's correct, I know it, I know it in practice, so they learn by heart and then fifteen days later they don't know anything. But hey, they have the certificate. So that's where we need to act, that's where we need to intervene.	fr	[60:55] C’est correcte, je le sais, je le connais dans la pratique, donc ils apprennent par cœur et puis quinze jours après ils ne savent plus rien. Mais bon, ils ont le certificat. Donc c’est là qu’il faut agir, c’est là qu’il faut intervenir. [61:12]	0
Yes, maybe to ask a little question: This documentation, I didn't read it very thoroughly. It is not clear to me what the common policy of the European Union is. So I don't know this immigration policy perfectly. I already know some national accents, but of the European Union, I don't know what are the main lines of their policy.	fr	[17:36] Oui, peut-être quand-même de poser une petite question : Cette documentation, je ne l’ai pas lue très approfondi. Il ne m’est pas claire quelle est la politique commune de l’Union Européenne. Donc cette politique de l’immigration, je ne la connais pas parfaitement. Je connais déjà quelques accents nationaux, mais de l’Union Européenne, je ne sais pas quels sont les grandes lignes de leur politique. [18 :02]	0
I think it's problematic to say you can help any country. A large part of Iran or Iraq may not think that way. Yes, I think it's problematic that you want to help these peoples, because a large part of the population doesn't see it that way. We are talking about those who are fleeing, that is a minority, and if you were to tell the Iranians, for example, that you have to help them, then many would be offended. They would find that arrogant. And that's why it all sounds very idealistic, but you have to keep in mind the real political situation and see what you can do, but also take into account that these peoples have their own pride.	de	[34:07] Ich halte es für problematisch, dass man sagt, man kann jedem Land helfen. Ein Grossteil im Iran oder im Irak denkt vielleicht nicht so. Ja, ich halte es für problematisch, dass man eben diesen Völkern helfen will, weil ein Grossteil der Bevölkerung sieht das gar nicht so. Wir reden ja von denen die fliehen, das ist eine Minderheit und wenn man den Iranern beispielsweise erzählen würde, man müsse ihnen helfen, dann wären viele beleidigt. Die empfinden das als arrogant. Und deswegen klingt das ja alles sehr idealistisch aber man muss sich die realen politischen Verhältnisse auch vor Augen halten und da schon sehen, was man machen kann, aber auch eben berücksichtigen, dass diese Völkerihren eigenen Stolz haben. [34:47]	0
We're on the wrong topic anyway, because we're talking about labor exchange within the EU and our topic is usually migration outside the EU.	de	[58:58] Wir sind sowieso beim falschen Thema, weil wir uns jetzt über Arbeitskräfteaustausch innerhalb der EU unterhalten und unser Thema ist ja normalerweise Migration ausserhalb der EU. [59:09]	0
As it comes to Holland, the asylum procedures are often very long, complicated and hard. So when someone comes to our country and applies for an asylum, things are really very complicated and practically, there are no structures which would enable to accommodate such people in an appropriate way. Some people had been living like that for 12 years and had not received any support. This is a real disaster for them and their future, especially for the young ones. What future do they have? They lose part of their youth and live like this, not otherwise. They cannot even attend school because they are illegal. So there are people who often are forced to leave our country and their children for example went to school and cannot pass the final exams and have no diplomas. These are the downsides and unpleasant sides of asylum procedures which are, well, necessary for the immigrants who I mentioned.	pl	[08:13] As it comes to Holland, the asylum procedures are often very long, complicated and hard. So when someone comes to our country and applies for an asylum, things are really very complicated and practically, there are no structures which would enable to accommodate such people in an appropriate way. Some people had been living like that for 12 years and had not received any support. This is a real disaster for them and their future, especially for the young ones. What future do they have? They lose part of their youth and live like this, not otherwise. They cannot even attend school because they are illegal. So there are people who often are forced to leave our country and their children for example went to school and cannot pass the final exams and have no diplomas. These are the downsides and unpleasant sides of asylum procedures which are, well, necessary for the immigrants who I mentioned.  [09:26]	0
So, we're talking about the problems caused by immigration. It is clear that there are problems. So, what are they? There is no money for everyone, everything is linked to the economy, which is ultimately the cement of the world, of Europe. Here, everything is finally posed in economic terms. And when the economic aspect is no longer relevant, and this is where we start talking about immigration in other terms than this that is not good, that is not interesting. But as long as the economic budget balance is good, finally nobody asks the question about immigration. On demand; but yes, let them come, let them come and let them come, if you need to build a church, fine, a synagogue, fine, if you need a mosque, too. But as soon as things go wrong, then finally the immigrants become a lot of misery. That's how it is in Spain. There is the cultural aspect of the church that has never been solved, well Franco solved it in his time, but not Spain. So, this cultural aspect of the church, when we talk about separating things, well, we will see the question of immigration with other eyes, as France does. But in Spain we have started to welcome immigrants, only a few years ago, with the obvious exception of South Americans. Obviously, it is the same language, so they were more easily welcomed. Now, Spain, it brings from Africa, they bring for Latin America, so, and everybody goes where they can go. Europe has always had open doors, when other countries elsewhere have not always been open like those of Europe and Spain is located in a place, obviously, that makes it receive many people who pass through, because afterwards they go to France, Belgium, Germany and this is a problem that we face. So even if it's a transit immigration, for a year or two or sometimes for a lifetime or sometimes it's not just a few days. So ultimately it's an economic issue. We don't talk about benefits today because things are bad. And if things were better, we could try to get into the debate. So we need to ask the economic question and better link it to this immigration question.	fr	[05 :42] Alors, on parle ici des problèmes causés par l’immigration. Il est clair qu’ils existent, des problèmes. Alors, quels-sont-ils ? Alors, il n’y a pas d’argent pour tout le monde, que tout et finalement lié à l’économie et qui est finalement le ciment du monde, enfin de l’Europe. Ici, tout est finalement posé en termes économiques. Et lorsque l’aspect économique n’a plus cours, et c’est là où on commence à parler de l’immigration d’autre termes que ceci que cela qui n’est pas bonne, qui n’est pas intéressant. Mais tant que l’équilibre budgétaire économique est bon, finalement personne ne se pose la question sur l’immigration. A la demande ; mais oui, faites-les venir, faites-les venir et qu’ils viennent, s’il faut construire une église, très bien, une synagogue, très bien, s’il faut une mosquée, aussi. Mais dès que les choses vont mal, alors finalement les immigrés deviennent beaucoup de misère. Voilà, c’est comme ça se passe en Espagne. Il y a l’aspect culturel de l’église qui n’a finalement jamais été résolu, bon Franco l’avait résolu dans son temps, mais pas l’Espagne. Donc, cet aspect culturel de l’église, quant on parlera à séparer les choses, et bien, on verra la question de l’immigration avec d’autres yeux, comme le fait la France. Mais en Espagne on a commencé à accueillir les immigrés, il y a très peu seulement,  à l’exception évidemment des Sud-Américains. Évidemment, c’est la même langue, donc ils ont été plus facilement accueillis. Maintenant, l’Espagne, elle apporte de l’Afrique, ils apportent pour l’Amérique Latine, donc, et tout le monde va là où il peut aller. L’Europe a toujours eu les portes ouvertes, quand d’autres pays ailleurs ne sont pas toujours étés ouvertes comme ceux de l’Europe et l’Espagne est située dans un lieu, évidemment, qui fait qu’elle accueille beaucoup des gens qui passe le passage, parce que après, ils se rendent en France, en Belgique, en Allemagne et c’est un problème auquel nous faisons face. Donc même si c’est une immigration de passage, d’un an ou deux ou parfois pour toute la vie ou parfois ce n’est pas uniquement quelques jours. Donc finalement c’est une question d’ordre économique. On ne parle pas d’avantages aujourd’hui parce que les choses sont males. Et si les choses allaient mieux, on peut essayer de rentre au débat.  Donc il faut plutôt poser la question économique et mieux la lié à cette question de l’immigration. [08 :43]	0
I never said that people, these people are ruining our lives. I said that we don't know how to integrate them and that we have to make an effort so that they integrate and have a decent life in France, in fact in France or in Germany.	fr	[49:01] J’ai jamais dit que les gens, ces gens nous pourrissent la vie. J’ai dit qu’on ne savait pas les intégrer et qu’il faut faire un effort pour qu’ils s’intègrent justement et qu’ils aient une vie décente en France, en fait en France ou en Allemagne. [49:15]	0
That's not what I meant by sealing off the borders, but I am of the opinion that targeted immigration is quite reasonable, only: We have to concentrate on those who have to think for us and concentrate on getting, among other things, people into the countries who have the appropriate professional experience, so that the work is not taken away from the lower income classes. So we have to work in a targeted way to get a grip on this. There are social aspects that come into it, but don't make a cage around it, but let others in and then do it properly and give the people who are there - the poor countries, where they say to themselves that enough has already been done to them in the colonies, that they should be given the opportunity to be able to build something in their own country and not as refugees - where you see these bad things on TV - that shouldn't be, but they should be able to develop at home in such a way that they don't have to do that; to drive here and drown.	de	[25:14] Das hab ich so nicht gemeint mit den Grenzen abschotten, sondern bin der Meinung, dass eine gezielte Zuwanderung durchaus vernünftig ist, nur: Wir müssen uns ja darauf konzentrieren, die für uns denken müssen und sich darauf konzentrieren, dass man unter anderem auch solche Leute rein bekommt in die Länder, die entsprechende Berufserfahrung haben, dass nicht den unteren Einkommensklassen die Arbeit weggenommen wird. Also es muss gezielt gearbeitet werden, um eben das richtig in den Griff zu bekommen. Es sind ja soziale Aspekte, die da mit reinkommen, aber nicht ein Käfig drum herum machen, sondern gezielt andere rein lassen und dann das richtig machen und denen Leuten, die da – die die armen Länder, wo sie sich sagen, denen wurde in den Kolonien schon genug angetan, denen sollte man die Möglichkeit geben, in ihrem eigenen Land etwas aufbauen zu können und nicht als Flüchtlinge – da wo man diese schlimmen Sachen sieht im Fernsehen – das darf nicht sein, aber die sollten sich zu Hause so entwickeln können, dass sie das nicht nötig haben, so was; hierher zu fahren und zu ertrinken. [26:34]	0
