cleaned_comment	orig_lang	speech	cGood
So what we could perhaps do is launch an appeal to the European Parliament so that they start to really develop a policy in this area. Because we have noticed that in practice there is no policy and so we need to create a common platform and so this should really be one of the main priorities because now they are all talking but nobody really dares to intervene. So it has to be a really big priority and maybe one day a solution will be found and then for me also this situation in the document, so a big priority is that the different countries can also increase the fines given to the employers who don't have illegals, so stricter fines, this would be the solution. So obviously now there's a lot of people who are paid half or a quarter of what they should be, there's no social contributions that are paid and so on so the state should intervene more rigorously so that it's really strongly limited.	fr	[47:23] Donc ce qu’on pourrait peut-être faire c’est lancer un appel par rapport aux Parlement Européen pour qu’ils commencent à vraiment développer une politique dans ce domaine-là. Parce qu’on a constaté que dans la pratique il n’y a pas de politique et donc il faut créer une plateforme commune et donc ce soit vraiment une des grandes priorités parce que maintenant ils parlent tous mais personne n’ose vraiment intervenir. Donc il faut que ce soit vraiment une grande priorité et peut-être qu’un jour à ce moment-là une solution sera trouvé et puis pour moi aussi cette situation dans le document, donc une grande priorité consiste à ce que les différents pays puissent aussi augmenter les amendes données aux employeurs qui n’ont pas des illégaux, donc des amendes plus strictes, ce serait la solution. Donc évidemment maintenant il y a beaucoup de gens qui sont payés la moitié ou un quart de ce qu’il faudrait, il n’y a pas de cotisations sociales qui sont payées et cetera donc l’état devrait intervenir plus rigoureusement pour que ce soit vraiment fortement limité. [48:47]	0
I think it's good that you bring the American example. We know, North America, own continent with two borders. They build a wall to the south, to Mexico with thousands of deaths. To the north, there is Canada, they don't need one. The Federal Republic of Germany is surrounded, is surrounded by friends, by EU members. There are highways. And in Germany you can drive without speed limit. And there you drive namely - from Austria, from Belgium, from Switzerland, even in the meantime - you drive smoothly through. I drive from Germany, Bavaria to Austria with 120 or 150 if I want to. Do we want to build borders again? The problem cannot be solved in this way. With border controls, dear Mario, is in Europe - we have 27 dwarf states in comparison, does not work at all; we would have a rat tail of costs, we would have walls, it is already enough the wall around the Palestinians, we can not do, first. Secondly, I have to emphasize again because we are in the EU, we are no longer talking about Spanish, Portuguese workers, because these are not immigrants, but these are EU citizens, that you finally keep it apart.	de	[26:30] Ich finde es gut, dass du das amerikanische Beispiel bringst. Wir wissen, Nordamerika, eigener Kontinent mit zwei Grenzen. Sie bauen eine Mauer nach Süden, nach Mexiko mit tausenden von Toten. Nach Norden, da ist Kanada, brauchen sie keine. Die Bundesrepublik Deutschland ist umgeben, ist umzingelt von Freunden, von EU-Mitgliedern. Da sind Autobahnen. Und in Deutschland darf man ohne Geschwindigkeitsbegrenzung fahren. Und da fährt man nämlich – von Österreich, von Belgien, von Schweiz, sogar inzwischen – fährt man glatt durch. Ich fahre von Deutschland, Bayern nach Österreich mit 120 oder 150 wenn ich will. Wollen wir da wieder Grenzen bauen? Das Problem ist so nicht zu lösen. Mit Grenzkontrollen, lieber Mario, ist in Europa – wir haben 27 Zwergstaaten im Vergleich, geht gar nicht; wir hätten einen Rattenschwanz von Kosten, wir hätten Mauern, es reicht schon die Mauer um die Palästinenser rum, können wir nicht machen, erstens. Zweiten muss ich nochmals betonen weil wir in der EU sind, wir reden nicht mehr von spanischen, portugiesischen Arbeitnehmern, weil das sind keine Einwanderer, sondern das sind EU- Mitbürger, dass man das endlich mal auseinander halten. [27:47]	2
Yes, if the immigrant worker is working well, if there are no problems regarding the law, then surely he is not in conflict with the law, then why can't he become legal? Why is there still problems then?	de	[45:08] Ja, wenn der eingewanderte Arbeiter gut arbeitet, wenn es keine Probleme gibt hinsichtlich des Gesetzes, dann ist er doch nicht in Konflikt mit dem Gesetz, warum kann er denn dann nicht legal werden? Warum gibt es da immer noch Probleme dann? [45:28]	0
In my opinion, those illegal immigrants should be granted legal residence, let them apply for legal stay and work.	pl	[37:43]In my opinion, those illegal immigrants should be granted legal residence, let them apply for legal stay and work. [37:59]	0
1011 Maybe we should find a general regulation with a limited freedom in order that some countries would be able to predict some additional regulations.	pl	1011[09:58] Maybe we should find a general regulation with a limited freedom in order that some countries would be able to predict some additional regulations. [00:16]	0
I think we have enough controls, so in particular on all the construction sites we still have the presence of the police, not regularly, and so I would like to avoid situations where we make certificates. So a lot of controls, so we have enough controls in my opinion, we should not buy back controls.	fr	[06:04] Je crois qu’on a suffisamment de contrôles, donc notamment sur tous les chantiers on a quand-même la présence de la police, pas régulièrement, et donc je voudrais éviter des situations où on fait des certificats. Donc beaucoup de contrôles, donc on a suffisamment de contrôles à mon avis, il ne faut pas racheter de contrôles. [06:26]	0
"I would like to say that I come from a city, Villeurbanne, which is next to Lyon, which is a city that, in 1900 in the 30's when it developed, welcomed a lot of immigrants, especially Spaniards and Italians, and we even have a street in Villeurbanne that is called ""la rue des bienvenus"". That is to say that by the name of a street, we welcome them. In my culture, Spanish and Italian immigrants have been very important. They were part of my culture and I enjoyed being around them. So I think that Europe should be a common skin space where all cultures can meet, mix and enrich each other. Now, on the question of immigration; itself, in particular of the non-European immigrants, who come on the territory of Europe, and who I find brings us the same enrichment as, I say, other populations, the question that I ask myself is basically that I always asked myself: When an immigrant comes to a country, does he not impoverish the country from which he leaves. This is the question I ask myself and obviously if I ask it, I have the answer: In general, it is the most dynamic people who make the superhuman effort to leave the country where they are. This was the case in the countries of war, there were only people who were a little dynamic, risking to be killed or to be caught by crossing the borders and I find that their country of origin misses them a lot. So that's it. That's the question I ask myself. Are we not impoverishing countries that are already poor by taking the best of their population?"	fr	[06 :40] Moi je voudrais dire je viens d’une ville, Villeurbanne, qui est à coté de Lyon, qui est une ville qui, en 1900 dans les années 30 au moment ou elle s’est développée, a accueilli énormément d’immigrés, surtout des espagnols et des italiens, et on a même une rue à Villeurbanne qui s’appelle «la  rue des bienvenus ». C'est-à-dire que par le nom d’une rue, on souhaitait la bienvenue. Moi, dans ma culture à mois, les immigrés espagnols, italiens ont beaucoup compté. Ils ont fait une partie de ma culture et j’ai beaucoup aimé les côtoyer. Voilà, alors je pense que l’Europe, s’(…) un petit peu cet espace de peau commun où toutes les cultures puissent se rencontrer, se mixer, et puis s’enrichir les une les autres. Maintenant, sur la question de l’immigration ; elle-même, en particulier des immigrés non-européen, qui viennent sur le territoire de l’Europe, et qui je trouve nous apporte le même enrichissement que, je dise, d’autres populations, la question que je me pose est au fond que je me suis toujours posé : Quand un immigré vient dans un pays, est-ce qu’il n’appauvrit pas le pays d’où il part. Voila la question que je me pose et évidemment si je la pose, j’ai la réponse : En général, se sont les gens les plus dynamiques, qui font l’effort surhumain de quitter le pays où ils sont. C’était le cas d’ailleurs, c’était le cas dans les pays de guerre, il y avait  que des gens un peu dynamique, risquer de se faire tuer ou de se faire prendre en passant des frontières et je trouve qu’ils manquent beaucoup à leur pays d’origine. Voilà. C’est un petit peu la question que je me pose. Est-ce qu’on n’appauvrit pas des pays qui sont déjà pauvres en leur prendre le meilleur de leur population. [09 :08]	0
If you think, Zbyszek, that army is not necessary; unless you would not want to live in the country where no military is. It would be very dangerous. If this whole budget would be dedicated to immigrants, your country could be ruined because someone will attack you. It would be a very risky venture. Thank you.	pl	[44:55]If you think, Zbyszek, that army is not necessary; unless you would not want to live in the country where no military is. It would be very dangerous. If this whole budget would be dedicated to immigrants, your country could be ruined because someone will attack you. It would be a very risky venture. Thank you.  [45:23]	0
I would like to respond so, Gudrun actually, I also see this problem of language and so in my opinion language is one of the factors. And it doesn't even have to be German, because they come to the European Union, so it would be better to find a solution - I don't know - French, English that they learn at least one language let's say common and so if there is this availability, then it doesn't pose any problems in my opinion.	fr	[59:53] Je voudrais réagir donc, Gudrun effectivement, je vois aussi ce problème de la langue et donc à mon avis la langue est un des facteurs. Et ça ne doit même pas être l’allemand, puisque ils viennent dans l’Union Européenne donc il vaudrait trouver une solution – je ne sais pas – le français, l’anglais qu’ils apprennent au moins une langue disons commune et donc s’il y a cette disponibilité-là, à ce moment-là ça ne pose pas de problèmes à mon avis. [60:27]	0
the selection, so indeed, as far as I am concerned, it is perhaps a threat. I don't think we should give in to that in Europe. We already said earlier that it's afternoon, at this point, we will perhaps choose those who, in the developing country, could contribute to the wealth there. And we will look for them there. We won't take those who are, who have malaria. That's not what we're going to do. We're going to choose the best ones, economically speaking. And so, we must not accept this. I think that we should first have respect for the people who had the courage to come to Europe. First of all. We sometimes underestimate. In a lifetime, you come from a completely different culture, a completely different continent. They come for the money, they say. And of course. And there's nothing wrong with wanting to earn more money. We all would like to. But if you have to select them by criteria, it becomes an economic selection, and you have to refuse that.	fr	[30 :02] la sélection, donc effectivement, en se qui me concerne, c'est peut-être une menace. Je ne pense pas qu’il faille céder a cela en Europe. On a déjà dit toute à l’heure c'est après-midi, a ce moment-là, on va peut-être choisir ceux qui, dans le pays en développement pourraient justement contribuer là-bas à la richesse. Et on va les chercher là-bas. On ne va pas prendre ceux qui sont, qui ont la malaria. Ça c'est pas ce qu’on va faire. On va choisir les meilleures, sous le plan économique. Et donc, ça il faut pas accepter ça. Moi je pense qu’il faut d’abord avoir du respect pour les gens qui ont eu le courage de venir en Europe. Avant tout. On sous-estime parfois. Dans une vie, on vient de toute autre culture, d’un tout autre continent. Ils viennent pour l’argent, dit on. Et bien sur. Et il n’y a pas de mal à vouloir gagner plus d’argent. On le voudrait tous. Mais s’il faut les sélectionner par rapport à des chritères, ça deviendra une sélection économique, et il faut refuser ça. [31 :17]	0
I understand the context of the Romanian colleague. I understand completely what Florin [FLO] just said and I would like to say to my colleague from Portugal [JOR] who spoke before. So maybe he did not understand me well. I think that the policy should be defined by the EU. So I totally agree with him. But I understand that the two criteria, which apparently are the most important, that is, each country has to apply its rules to its reality. So health and safety must be implemented and applied by the own countries, each country, there, must have sovereignty. And if the country thinks that there are other criteria, well, it will apply its own criteria. So on the basis of each reality in each country. And I disagree a bit with Magda [MAG]. She makes the mention here to the friends from the east. But immigration for us is not only from the East. Immigration comes from everywhere. It comes from Africa, in particular. In Portugal, we have Africans, Brazilians, and some people from the Balkans, for example. We also had some, for a while, Chinese. So health and safety, be it, opened up. I remind you that the Influenza A, this influx of Influenza A. How do we control the states? First we have to define the rules, we have the Schengen area, I don't know if you know well what the Schengen state means. When there is a health problem, all the borders will close in the Schengen area. So, it's very good, I think we have to create single market habits, but in reality and in the very near future, we will not be a free movement of people area, no. It's a wish, but in reality it doesn't happen like that. Because we must obviously take into account the fatalities. Finally, the criteria of health and safety, because terrorism is another problem. So I remind you that in the case of immigration we must remember that ... what criteria; are we going to say yes to the Europeans? Are we going to say no to the Brazilians, to the Africans? Do we create quotas? What do we do? We, in Portugal, have the sea, it is our border with Africa and Brazil. It is the Atlantic sea. And in the frame, Adrien obviously mentioned some European countries, which are east of Romania. This is my opinion, honestly. [1 :	fr	[1 :28 :52] Je comprends le contexte du collègue roumain. Je comprends tout à fait ce que vient de dire Florin[FLO] et j’aimerais dire à mon collègue de Portugal[JOR] qui a parlé avant. Alors peut-être il ne m’a pas bien compris. Je pense que la politique doit être définie par l’UE. Donc je suis tout à fait d’accord avec lui. Mais je comprends que les deux critères, qui apparemment sont les plus importantes, c'est-à-dire chaque pays doive appliquer à sa réalité ses règles. Donc la santé et la sécurité doivent être mises en œuvre et appliquées par les propres pays chaque pays, là, doit avoir une souveraineté. Et si le pays pense qu’il y a d’autres critères, bon, il appliquera ses propres critères. Donc sur base de chaque réalité dans chaque pays. Et je suis un peu en désaccord avec Magda[MAG]. Elle fait la mention ici aux amis de l’est. Mais l’immigration pour nous, ce n’est pas seulement de l’est. L’immigration, ça vient de partout. Ça vient d’Afrique, notamment. Au Portugal, nous avons des Africains, des Brésiliens, et quelques personnes du Balkan, par exemple. Nous avons eu également quelques, pendant un certain temps, des Chinois. Donc santé et sécurité, soit être, s’ouvra[ ?]. Je rappelle que la Grippe A, cet afflux de Grippe A. Comment contrôlons-nous les états ? On doit d’abord définir les règles, nous avons l’espace de Schengen, je ne sais pas si vous savez bien ce que signifie l’état Schengen. Quand il y a un problème de santé, toutes les frontières vont se fermer dans l’espace Schengen. Donc, c’est très bon, je pense que nous devons créer des habitudes de marché unique, mais dans la réalité et dans un avenir très proche, nous ne serons pas un espace de libre circulation des personnes, non. C’est un souhait, mais en réalité ça ne se passe pas comme ça. Parce que nous devons évidemment se tenir compte des fatalités. Enfin, les critères de santé et sécurité, parce que le terrorisme, c’est un autre problème. Donc je rappelle que dans le cas d’immigration nous devons nous rappeler que … quels critères ; est-ce-que on va dire oui aux européens ? On va dire non aux  Brésiliens, aux Africains ? On crée des quotas? On fait quoi ? Nous, en Portugal, nous avons la mer, c’est notre frontière avec l’Afrique et le Brésil. C’est la mer de l’Atlantique. Et dans le cadre, Adrien évidement il a fait mention à des pays de l’Europe, qui sont à l’est de Roumanie. C’est mon opinion sincèrement. [1 :32 :12]	0
"So now we're going to bury the dead and we're obviously going to treat the living. That's what they say, well, that's what Marques de Pombal said after the great earthquake in the 18th [century]. I disagree with that. So why do I disagree? These people, these immigrants, were needed for a period of time. They worked in the fields. They picked melons, for example. I only talk about Spain, because that's what I saw in the report. Because Spain is a very pragmatic case. Well, it's clear, it's real. I have nothing against ""nuestros hermanos"", Spanish people, but these people worked, legally or illegally, I repeat, make a difference - I don't know. But while Spain was a great economic power, these people helped the country, well Spain developed, built roads and so on and so forth. And now, when they are not needed anymore, they are given a little ticket. Here you are, go home. But look at it this way: If these people had been protected, if they earned as much as the Spanish, of course, it's in the merit, you earn more or less. Yes, but I do not agree that the work of an immigrant is paid less than the work of a Spaniard. No. Unfortunately, this is what has happened. Immigrants earn less. [1 :"	fr	[1:47:23] Donc maintenant on va enterrer les morts et on va évidement soigner les vivants. C’est ce qu’on dit, enfin, c’est ce que Marques de Pombal a dit après le grand tremblement de terre au 18ème [siècle]. Là, je suis en désaccord. Donc pourquoi je suis en désaccord ? Ces gens, ces immigrées, ont été nécessaires pendant une période de temps. Ils ont travaillé dans les champs. Ils ont ramassé des melons notamment. Je parle que de l’Espagne, parce que c’est ce que j’ai vu dans le reportage. Parce que l’Espagne c’est un cas très pragmatique. Enfin, c’est clair, c’est réel. J’ai rien contre «nuestros hermanos», les espagnoles, mais ces personnes ont travaillé, de façon légale ou illégale, je répète, faire une différence - je ne sais pas. Mais pendent l’Espagne était une grande puissance économique, ces gens ont aidé le pays, enfin l’Espagne a se développée, a construit des routes et cetera et j’en passe. Et maintenant, une fois qu’ils ne sont plus nécessaires, et voilà, on leur donne un petit billet. Tiens, voici, rentre chez toi. Mais regardez bien : Si ces gens avaient été protégés, s’ils gagnaient autant que les espagnoles, évidemment, c’est dans le mérite, on gagne plus ou moins. Oui, mais je ne suis pas d’accord que le travail d’un immigre soit moins payé que le travail d’un espagnol. Non. Malheureusement, c’est ce qui c’est passé. Les immigrées gagnent moins. [1 :49 :05]	0
... I had the pleasure of being accepted in France to complete my education. I worked in France for two years and it was very good for me. Why not offer others, even if they are not from the EC, this opportunity to come to us to learn something from us, and vice versa, we can learn something from them as well. But we have been talking a bit more intensively about illegal immigrants, which is a completely different topic again, Holger.	de	[26:24] … hatte ich das Vergnügen, in Frankreich aufgenommen zu werden, um meine Ausbildung zu vollenden. Ich habe zwei Jahre in Frankreich gearbeitet und das hat mir sehr gut getan. Warum sollte man anderen, auch wenn sie nicht aus der EG kommen, nicht auch diese Möglichkeit bieten, zu uns zu kommen, um bei uns etwas zu lernen, und wir umgekehrt von denen auch etwas lernen können. Aber wir sprachen ja die ganze Zeit bisher eigentlich etwas intensiver von illegalen Einwanderern, das ist ja wieder ein ganz anderes Thema Holger. [27:04]	0
We can compare this situation to how the black people were treated a long time ago. How the people were taking advantage of them. It was also profitable for some people but in some extent. We can not trade with people. They work just like we do and want to live just like we want.	pl	[1:28:53] We can compare this situation to how the black people were treated a long time ago. How the people were taking advantage of them. It was also profitable for some people but in some extent. We can not trade with people. They work just like we do and want to live just like we want.[1:29:04]	0
In the case of construction workers, we are loosing on that. They are not paying us well so we are not taking this job.	pl	[1:29:12] In the case of construction workers, we are loosing on that. They are not paying us well so we are not taking this job.[1:29:26]	0
yeah, so. I've been looking at the statistics. And in Spain, you find that the increase in immigration also has a significant impact on the prison population in our country. So, for example, remand prison inmates or also criminal prison. And so, there are more immigrants in this than inmates from the national population. So 30 percent of immigrants were now in prison. So more than last year, by the way. Now, I don't have the exact numbers on that, of course, but there is a significant difference there between prisoners who are immigrants or our own. And you can see, so with the crisis, the number of immigrants who end up in prison then increases additionally.	de	[20:18] ja, also. Ich habe mich mit den Statistiken beschäftigt. Und in Spanien stellt man fest, dass die Steigerung der Einwanderung auch eine erhebliche Auswirkung hat auf die Gefängnisinsassen bei uns. Also zum Beispiel Untersuchungsgefängnisinsassen oder auch Strafgefängnis. Und also, es gibt dabei mehr Einwanderer als Häftlinge aus der nationalen Bevölkerung. 30 Prozent der Einwanderer waren also inzwischen im Gefängnis. Also übrigens mehr als im letzten Jahr. Jetzt habe ich darüber natürlich nicht die genauen Zahlen, aber es gibt da einen erheblichen Unterschied zwischen den Gefangenen, die Einwanderer sind, oder unseren eigenen. Und man sieht, also mit der Krise steigt die Zahl der Einwanderer die im Gefängnis landen dann noch zusätzlich. [21:15]	1
yes, so I suggest that we are Spanish and German here, can we have questions on both sides, on Spanish and on German...	de	[1:20:07] ja, also ich schlage vor, dass wir ja hier Spanier und Deutsche sind, kann man doch auf beiden Seiten, auf spanischer und auf deutscher Fragen… [1:20:15]	1
